{
  "memoryId": "0198f6b4-6f3c-7de1-86e8-5d223ab25450",
  "tenantId": "tenant-a",
  "projectId": "iroute-project",
  "kind": "Decision",
  "key": "activeDecisions[0]",
  "version": 1,
  "value": "Use the Markdown specification as the source of truth.",
  "contentHash": "d64f10a7d2f55ddfbfbc01da4436981de4450db4542138a699cdd6ef5e998a3f",
  "lifecycleStatus": "Active",
  "evidence": [
    {
      "kind": "request.input",
      "reference": "0198f6b4-6f3c-7de1-86e8-5d223ab2544f",
      "contentHash": "d64f10a7d2f55ddfbfbc01da4436981de4450db4542138a699cdd6ef5e998a3f",
      "observedAt": "2026-07-31T12:00:00Z"
    }
  ],
  "dependencies": [
    {
      "kind": "request.input",
      "reference": "email.draft:activeDecisions[0]",
      "contentHash": "d64f10a7d2f55ddfbfbc01da4436981de4450db4542138a699cdd6ef5e998a3f"
    }
  ],
  "createdAt": "2026-07-31T12:00:00Z",
  "expiresAt": null,
  "supersedesMemoryId": null,
  "supersededByMemoryId": null,
  "invalidatedAt": null,
  "invalidationReason": null
}
